id,url,headline,author,date
5,https://www.theverge.com/23653141/tiktok-ban-bytedance-congress-hearing-first-amendment-open-internet,The TikTok ban is a betrayal of the open internet,Adi Robertson,Mar 27
4,https://www.theverge.com/23654936/aqara-g4-video-doorbell-review,Aqara Video Doorbell G4 review: this battery-powered buzzer needs to go back to basics,Jennifer Pattison Tuohy,Mar 27
3,https://www.theverge.com/2023/3/27/23659109/binance-cftc-vpn-signal-notes,"Binance really loved telling people to use VPNs, allegedly",Elizabeth Lopatto,Mar 27
2,https://www.theverge.com/2023/3/27/23658630/diablo-iv-beta-impressions-pc-ps5,The Diablo IV beta let players do a lot — but not pet the dog,Ash Parrish,Mar 27
1,https://www.theverge.com/2023/3/27/23657938/microsoft-teams-overhaul-performance-improvements-ui-design-changes-features,The new Microsoft Teams is here with big performance improvements and UI changes,Tom Warren,Mar 27
